{
  "title": "AI 产品增长策略",
  "goal": "面向管理层说明 AI 产品增长机会、核心指标和落地路径",
  "audience": "管理层",
  "owner": "产品策略团队",
  "randomSeed": "theme02-showcase-2026",
  "pageCount": 5,
  "themePack": "theme02",
  "delivery": {"watermark": false},
  "slides": [
    {
      "layout": "theme02_page001",
      "props": {
        "kicker": "PPT大师 · 科技发布示例",
        "title": "AI 产品",
        "titleEm": "增长策略",
        "subtitle": "从用户价值、产品体验和商业转化三个层面，构建可持续增长路径。",
        "stat": {"value": "3×", "unit": "增长空间", "caption": "三类重点场景形成增长飞轮"},
        "footnote": ["汇报对象：管理层", "演示版本：2026", "生成方式：PPT大师"],
        "tags": ["产品策略", "增长路径", "执行计划"],
        "imageCount": 0
      }
    },
    {
      "layout": "theme02_page006",
      "props": {
        "kicker": "01 · 增长框架",
        "title": "三条增长主线",
        "titleEm": "价值先行",
        "intro": "增长不只来自流量，更来自价值表达、首次体验和持续复用。",
        "cards": [
          {"tag": "VALUE", "title": "讲清价值", "axis": "认知", "desc": "让用户在十秒内知道产品能解决什么问题。"},
          {"tag": "ACTIVATE", "title": "快速体验", "axis": "激活", "desc": "用低门槛示例帮助用户完成第一次成功。"},
          {"tag": "RETAIN", "title": "形成复用", "axis": "留存", "desc": "围绕高频场景沉淀模板和可复用工作流。"}
        ],
        "cardCount": 3,
        "index": "01"
      }
    },
    {
      "layout": "theme02_page021",
      "props": {
        "kicker": "02 · 核心指标",
        "value": "68%",
        "unit": "激活率目标",
        "caption": "用户完成第一次关键动作",
        "lead": "用明确入口、即时反馈和示例任务，把注册用户更快带到首次成功。",
        "support": [
          {"value": "10", "unit": "秒", "label": "看懂价值"},
          {"value": "3", "unit": "分钟", "label": "完成体验"},
          {"value": "1", "unit": "个入口", "label": "主行动"}
        ],
        "supportCount": 3,
        "index": "02"
      }
    },
    {
      "layout": "theme02_page044",
      "props": {
        "kicker": "03 · 执行路径",
        "title": "四步形成闭环",
        "titleEm": "持续增长",
        "steps": [
          {"title": "看懂", "desc": "一句话说明价值并展示真实效果。"},
          {"title": "体验", "desc": "用示例任务快速完成首次成功。"},
          {"title": "转化", "desc": "在价值确认后引导注册与付费。"},
          {"title": "复用", "desc": "通过模板和记录提高再次使用率。"}
        ],
        "stepCount": 4,
        "index": "03"
      }
    },
    {
      "layout": "theme02_page074",
      "props": {
        "kicker": "PPT MASTER",
        "ghost": "NEXT STEP",
        "statement": "把想法变成",
        "statementEm": "专业表达",
        "sub": "一句话即可开始，生成后仍能继续编辑，并按需要导出 HTML、PDF 或 PPTX。",
        "signature": {"org": "PPT大师", "date": "2026", "note": "让每一次演示更有说服力"},
        "index": "05"
      }
    }
  ]
}
